{"buildInputsSha256":"648220f0fb543de7a91326553fe51cd74cecd8488c76e963ccbc9fe99560108a","coordinateSystem":{"byteEncoding":"utf-8","byteRange":"half-open","columnBase":0,"columnEncoding":"utf-8-bytes","lineBase":1},"format":"wordpresshx.php-haxe-range-map.v1","generated":{"byteLength":1472,"encoding":"utf-8","lineCount":55,"lineEndings":"lf","path":"includes/FailureCallbacks.php","sha256":"d3534a6374ebec4ded2265850d93fb0be6f2b73c55f4ac213cbb6e811db00dc2"},"generator":{"id":"wordpresshx.reflaxe.php","sourceSha256":"5087bc6d3d32afe22771f2bd3f2f9a25e978fbaa717eb16635eab8899de18fa9","version":"0.0.0+sdk025"},"mappings":[{"generatedSpan":{"end":{"columnUtf8":1,"line":55},"endByte":1471,"start":{"columnUtf8":0,"line":7},"startByte":65},"id":"fixture:source-correlation:class","nodeKind":"declaration","origin":{"kind":"haxe-source","semanticNodeId":"fixture:source-correlation:class","sourceId":"fixture:source-correlation","sourceSpan":{"end":{"columnUtf8":0,"line":38},"endByte":1061,"start":{"columnUtf8":0,"line":4},"startByte":114}},"structuralDepth":0},{"generatedSpan":{"end":{"columnUtf8":2,"line":10},"endByte":184,"start":{"columnUtf8":1,"line":8},"startByte":91},"id":"fixture:source-correlation:method:hook","nodeKind":"member","origin":{"kind":"haxe-source","semanticNodeId":"fixture:source-correlation:method:hook","sourceId":"fixture:source-correlation","sourceSpan":{"end":{"columnUtf8":2,"line":7},"endByte":237,"start":{"columnUtf8":1,"line":5},"startByte":150}},"structuralDepth":1},{"generatedSpan":{"end":{"columnUtf8":48,"line":9},"endByte":181,"start":{"columnUtf8":2,"line":9},"startByte":135},"id":"fixture:source-correlation:throw:hook","nodeKind":"statement","origin":{"kind":"haxe-source","semanticNodeId":"fixture:source-correlation:throw:hook","sourceId":"fixture:source-correlation","sourceSpan":{"end":{"columnUtf8":43,"line":6},"endByte":234,"start":{"columnUtf8":2,"line":6},"startByte":193}},"structuralDepth":2},{"generatedSpan":{"end":{"columnUtf8":2,"line":15},"endByte":293,"start":{"columnUtf8":1,"line":12},"startByte":187},"id":"fixture:source-correlation:method:rest-permission","nodeKind":"member","origin":{"kind":"haxe-source","semanticNodeId":"fixture:source-correlation:method:rest-permission","sourceId":"fixture:source-correlation","sourceSpan":{"end":{"columnUtf8":2,"line":11},"endByte":335,"start":{"columnUtf8":1,"line":9},"startByte":240}},"structuralDepth":1},{"generatedSpan":{"end":{"columnUtf8":2,"line":20},"endByte":437,"start":{"columnUtf8":1,"line":17},"startByte":296},"id":"fixture:source-correlation:method:rest","nodeKind":"member","origin":{"kind":"haxe-source","semanticNodeId":"fixture:source-correlation:method:rest","sourceId":"fixture:source-correlation","sourceSpan":{"end":{"columnUtf8":2,"line":15},"endByte":486,"start":{"columnUtf8":1,"line":13},"startByte":338}},"structuralDepth":1},{"generatedSpan":{"end":{"columnUtf8":48,"line":19},"endByte":434,"start":{"columnUtf8":2,"line":19},"startByte":388},"id":"fixture:source-correlation:throw:rest","nodeKind":"statement","origin":{"kind":"haxe-source","semanticNodeId":"fixture:source-correlation:throw:rest","sourceId":"fixture:source-correlation","sourceSpan":{"end":{"columnUtf8":43,"line":14},"endByte":483,"start":{"columnUtf8":2,"line":14},"startByte":442}},"structuralDepth":2},{"generatedSpan":{"end":{"columnUtf8":2,"line":32},"endByte":795,"start":{"columnUtf8":1,"line":22},"startByte":440},"id":"fixture:source-correlation:method:render","nodeKind":"member","origin":{"kind":"haxe-source","semanticNodeId":"fixture:source-correlation:method:render","sourceId":"fixture:source-correlation","sourceSpan":{"end":{"columnUtf8":2,"line":19},"endByte":672,"start":{"columnUtf8":1,"line":17},"startByte":489}},"structuralDepth":1},{"generatedSpan":{"end":{"columnUtf8":50,"line":31},"endByte":792,"start":{"columnUtf8":2,"line":31},"startByte":744},"id":"fixture:source-correlation:throw:render","nodeKind":"statement","origin":{"kind":"haxe-source","semanticNodeId":"fixture:source-correlation:throw:render","sourceId":"fixture:source-correlation","sourceSpan":{"end":{"columnUtf8":45,"line":18},"endByte":669,"start":{"columnUtf8":2,"line":18},"startByte":626}},"structuralDepth":2},{"generatedSpan":{"end":{"columnUtf8":2,"line":36},"endByte":871,"start":{"columnUtf8":1,"line":34},"startByte":798},"id":"fixture:source-correlation:method:private-entry","nodeKind":"member","origin":{"kind":"haxe-source","semanticNodeId":"fixture:source-correlation:method:private-entry","sourceId":"fixture:source-correlation","sourceSpan":{"end":{"columnUtf8":2,"line":23},"endByte":741,"start":{"columnUtf8":1,"line":21},"startByte":675}},"structuralDepth":1},{"generatedSpan":{"end":{"columnUtf8":2,"line":40},"endByte":977,"start":{"columnUtf8":1,"line":38},"startByte":874},"id":"fixture:source-correlation:method:private","nodeKind":"member","origin":{"kind":"haxe-source","semanticNodeId":"fixture:source-correlation:method:private","sourceId":"fixture:source-correlation","sourceSpan":{"end":{"columnUtf8":2,"line":27},"endByte":833,"start":{"columnUtf8":1,"line":25},"startByte":744}},"structuralDepth":1},{"generatedSpan":{"end":{"columnUtf8":51,"line":39},"endByte":974,"start":{"columnUtf8":2,"line":39},"startByte":925},"id":"fixture:source-correlation:throw:private","nodeKind":"statement","origin":{"kind":"haxe-source","semanticNodeId":"fixture:source-correlation:throw:private","sourceId":"fixture:source-correlation","sourceSpan":{"end":{"columnUtf8":46,"line":26},"endByte":830,"start":{"columnUtf8":2,"line":26},"startByte":786}},"structuralDepth":2},{"generatedSpan":{"end":{"columnUtf8":2,"line":48},"endByte":1287,"start":{"columnUtf8":1,"line":42},"startByte":980},"id":"fixture:source-correlation:class:synthesized:registerrestroutes","nodeKind":"member","origin":{"kind":"haxe-source","semanticNodeId":"fixture:source-correlation:class:synthesized:registerrestroutes","sourceId":"fixture:source-correlation","sourceSpan":{"end":{"columnUtf8":0,"line":38},"endByte":1061,"start":{"columnUtf8":0,"line":4},"startByte":114}},"structuralDepth":1},{"generatedSpan":{"end":{"columnUtf8":2,"line":54},"endByte":1469,"start":{"columnUtf8":1,"line":50},"startByte":1290},"id":"fixture:source-correlation:class:synthesized:registerblocks","nodeKind":"member","origin":{"kind":"haxe-source","semanticNodeId":"fixture:source-correlation:class:synthesized:registerblocks","sourceId":"fixture:source-correlation","sourceSpan":{"end":{"columnUtf8":0,"line":38},"endByte":1061,"start":{"columnUtf8":0,"line":4},"startByte":114}},"structuralDepth":1}],"schemaVersion":1,"sources":[{"byteLength":1061,"id":"fixture:source-correlation","kind":"haxe","lineCount":37,"path":"compiler/wordpress/test/fixtures/SourceCorrelationCallbacks.hx","rootId":"project","sha256":"d274806fe5ae2ac89709f8568797723dee701044ec31cfe6ceeccd58f38cb833"}],"traceAnchors":[{"generatedLine":9,"mappingId":"fixture:source-correlation:throw:hook","selection":"emitter-runtime-line"},{"generatedLine":19,"mappingId":"fixture:source-correlation:throw:rest","selection":"emitter-runtime-line"},{"generatedLine":31,"mappingId":"fixture:source-correlation:throw:render","selection":"emitter-runtime-line"},{"generatedLine":39,"mappingId":"fixture:source-correlation:throw:private","selection":"emitter-runtime-line"}]}
